{
  "schema_version": 1,
  "id": "fixture-stage2-integration-depth-proofs-preview",
  "source_composition_id": "fixture-http-stage2-v1",
  "source_composition_digest": "sha256:f562551e4081576ed603010e77f025d1a78b91feefde57647c48c300259293ce",
  "target_composition_ids": ["fixture-http-stage2-v2-bounded-preview", "fixture-http-stage2-v2-definitive-preview"],
  "scope": "bounded-v1-fixture",
  "proofs": [
    {"id":"integration.communication","axis":"communication","scenario_id":"normal","profiles":[{"profile":"local","path":"evidence/runs/local/normal.json","digest":"sha256:85b6adfd9d756123a309ae789057e4344067c598bbe660468c9840d2ef0afead"},{"profile":"container","path":"evidence/runs/container/normal.json","digest":"sha256:bc04ca3801687856c798842056e8ed741109c234aba0735b492c14481f557b48"}]},
    {"id":"integration.identity","axis":"identity","scenario_id":"normal","profiles":[{"profile":"local","path":"evidence/runs/local/normal.json","digest":"sha256:85b6adfd9d756123a309ae789057e4344067c598bbe660468c9840d2ef0afead"},{"profile":"container","path":"evidence/runs/container/normal.json","digest":"sha256:bc04ca3801687856c798842056e8ed741109c234aba0735b492c14481f557b48"}]},
    {"id":"integration.data","axis":"data","scenario_id":"normal","profiles":[{"profile":"local","path":"evidence/runs/local/normal.json","digest":"sha256:85b6adfd9d756123a309ae789057e4344067c598bbe660468c9840d2ef0afead"},{"profile":"container","path":"evidence/runs/container/normal.json","digest":"sha256:bc04ca3801687856c798842056e8ed741109c234aba0735b492c14481f557b48"}]},
    {"id":"integration.messaging","axis":"messaging","scenario_id":"normal","profiles":[{"profile":"local","path":"evidence/runs/local/normal.json","digest":"sha256:85b6adfd9d756123a309ae789057e4344067c598bbe660468c9840d2ef0afead"},{"profile":"container","path":"evidence/runs/container/normal.json","digest":"sha256:bc04ca3801687856c798842056e8ed741109c234aba0735b492c14481f557b48"}]},
    {"id":"integration.deployment","axis":"deployment","scenario_id":"normal","profiles":[{"profile":"local","path":"evidence/runs/local/normal.json","digest":"sha256:85b6adfd9d756123a309ae789057e4344067c598bbe660468c9840d2ef0afead"},{"profile":"container","path":"evidence/runs/container/normal.json","digest":"sha256:bc04ca3801687856c798842056e8ed741109c234aba0735b492c14481f557b48"}]},
    {"id":"integration.observability","axis":"observability","scenario_id":"normal","profiles":[{"profile":"local","path":"evidence/runs/local/normal.json","digest":"sha256:85b6adfd9d756123a309ae789057e4344067c598bbe660468c9840d2ef0afead"},{"profile":"container","path":"evidence/runs/container/normal.json","digest":"sha256:bc04ca3801687856c798842056e8ed741109c234aba0735b492c14481f557b48"}]},
    {"id":"integration.security-boundary","axis":"security-boundary","scenario_id":"rejection","profiles":[{"profile":"local","path":"evidence/runs/local/rejection.json","digest":"sha256:1759c0dd1184ac2925b63c192de5e5e4f78b21443e78ef2c333aa9f6177d4eb1"},{"profile":"container","path":"evidence/runs/container/rejection.json","digest":"sha256:dbab0b4afa42cb71b977d665e69d5888ddd418c0a7fea6b323b50f265e7663dd"}]},
    {"id":"integration.failure-propagation","axis":"failure-propagation","scenario_id":"failure","profiles":[{"profile":"local","path":"evidence/runs/local/failure.json","digest":"sha256:b0e2d2390e084005332ea5b84bb31b80f132328677266bf68784609da3429488"},{"profile":"container","path":"evidence/runs/container/failure.json","digest":"sha256:4c71c0fb799c137d76c7f996b3b9336ed07a659269fb207489fb5e4064d5f447"}]},
    {"id":"integration.recovery","axis":"recovery","scenario_id":"recovery","profiles":[{"profile":"local","path":"evidence/runs/local/recovery.json","digest":"sha256:dc17a5ca1aa1a06c3dd49abcfd02c56c21be1a575e40785a13737d11b87f61e5"},{"profile":"container","path":"evidence/runs/container/recovery.json","digest":"sha256:d05fd7417193a4c21a1bbcd08efed346beb5d99e026a9e7ea3747fd4a083db68"}]},
    {"id":"integration.compatibility","axis":"compatibility","scenario_id":"compatibility","profiles":[{"profile":"local","path":"evidence/runs/local/compatibility.json","digest":"sha256:059754e00bdf32405d1ba8ceaf25be0bd43634e9726a82ea853d7504263b6f4e"},{"profile":"container","path":"evidence/runs/container/compatibility.json","digest":"sha256:aa4799286e4ae5c7bfc622588646da1f58c2fc44c133004fd6fbd7eb4bfbe0b3"}]}
  ],
  "verdict": "pass"
}
